<?xml version="1.0" encoding="UTF-8"?>
<Hochschullabore 
    xmlns="hsLabSchema"
    xmlns:xsi="http://www.w3.org/2001/XMLSchema-instance"
    xsi:schemaLocation="hsLabSchema hochschullabore.xsd">
    <Labor name="Multimedialabor" raumNr="Z2320">
        <Rechner inventarNr="000.002">
            <Anschaffungsdatum datum="2016-10-28"/>
            <Beschreibung>Rechner des Dozenten</Beschreibung>
            <Betriebssystem name="Windows1"/>
        </Rechner>
        <Rechner inventarNr="000.002">
            <Anschaffungsdatum datum="2010-02-01"/>
            <Beschreibung>Dies ist eine kurze Beschreibung des Rechners</Beschreibung>
            <Besonderheit>Mainboard wurde getauscht</Besonderheit>
            <Besonderheit>Gehäuse stark beschädtigt</Besonderheit>
            <Betriebssystem name="Windows10"/>
            <Anwendungssoftware name="eclipse" lizenz="false"/>
            <Anwendungssoftware name="oxygen" lizenz="true"/>
            <Anwendungssoftware name="AdobeReader"/>
            <Erweiterung>
                <Beschreibung>Zusätzliche Festplatte</Beschreibung>
                <Besonderheit><Hersteller>Samsung</Hersteller></Besonderheit>
                <Besonderheit>SSD</Besonderheit>
                <Besonderheit>SATAIII</Besonderheit>
                <Besonderheit>256 GB</Besonderheit>
            </Erweiterung>
            <Erweiterung>
                <Beschreibung>Zusätzlicher Arbeitsspeicher</Beschreibung>
                <Besonderheit>DDR4</Besonderheit>
                <Besonderheit>8GB Riegel</Besonderheit>
            </Erweiterung>
            <Erweiterung>
                <Beschreibung>Dedizierte Grafikkarte von <Hersteller>GIGABYTE</Hersteller></Beschreibung>
            </Erweiterung>
        </Rechner>
        <Rechner inventarNr="000.003">
            <Anschaffungsdatum datum="2010-02-01"/>
            <Beschreibung>Dies ist eine kurze Beschreibung des Rechners</Beschreibung>
            <Besonderheit>Kaugummi im USB Port vorne</Besonderheit>
            <Betriebssystem name="Windows10"/>
            <Anwendungssoftware name="eclipse" lizenz="false"/> 
            <Anwendungssoftware name="oxygen" lizenz="true"/>
            <Anwendungssoftware name="AdobeReader"/>
            <Erweiterung>
                <Beschreibung>zusätzliche Festplatte</Beschreibung>
                <Besonderheit>HDD</Besonderheit>
                <Besonderheit>SATAII</Besonderheit>
                <Besonderheit>1 TB</Besonderheit>
            </Erweiterung>
        </Rechner>
        <Rechner inventarNr="000.004">
            <Anschaffungsdatum datum="2010-02-01"/>
            <Beschreibung>
                CPU: <Hersteller>Intel</Hersteller> Core i5-6500K
                Arbeitsspeicher: 8GB
                Festplatte1: 128 GB SSD
                Festplatte2: 1 TB HDD 
                Busbreite: 64 Bit
                PCI: 3x
                SATAIII: 6x (intern)
                USB 3.1: 1x
                USB 3.1 Typ C: 1x
                USB 3.0: 6x
                USB 2.0: 3x
                Grafik: <Hersteller>NVIDIA</Hersteller> GeForce GTX950
                Optisches Laufwerk: DVD Brenner
                DVI: 2x
                VGA: 1x
                HDMI: 4x
                Displayport: 3x
            </Beschreibung>
            <Betriebssystem name="Windows10"/>
            <Anwendungssoftware name="eclipse" lizenz="false"/> 
            <Anwendungssoftware name="oxygen" lizenz="true"/>
            <Anwendungssoftware name="AdobeReader"/>
            <Erweiterung>
                <Beschreibung>Gaming Mainboard</Beschreibung>
                <Besonderheit>1150 Socket</Besonderheit>
                <Besonderheit>4x DDR3 RAM Slots</Besonderheit>
                <Besonderheit>2 HDMI anschluss</Besonderheit>
            </Erweiterung>
        </Rechner>
        <Hardware>
            <Peripherie inventarNr="000.005" bezeichnung="Drucker"/>
            <Peripherie inventarNr="000.006" bezeichnung="Beamer"/>
            <Peripherie inventarNr="000.007" bezeichnung="Bildschirm"/>
        </Hardware>
        <Softwarelizenzen>
            <Betriebssystem name="Windows10">
                <Beschreibung>Windows10 ist ein gutes Betriebssystem</Beschreibung>
                <Besonderheit>ist ganz gut</Besonderheit>
            </Betriebssystem> 
            <Betriebssystem name="Windows7">
                <Beschreibung>Windows7 war ein sehr geiles Betriebssystem</Beschreibung>
                <Besonderheit>Sehr geil</Besonderheit>
            </Betriebssystem>
            <Anwendungssoftware name="MS-Projekt" anzahl="25">
                <Beschreibung>Text</Beschreibung>
                <Besonderheit>Text</Besonderheit>
            </Anwendungssoftware> 
            <Anwendungssoftware name="Eclipse">
                <Beschreibung>Text</Beschreibung>
                <Besonderheit>Text</Besonderheit>
            </Anwendungssoftware>
            <Anwendungssoftware name="Oxygen">
                <Beschreibung>Text</Beschreibung>
            </Anwendungssoftware>
            <Anwendungssoftware name="AdobeReader">
                <Beschreibung>Text</Beschreibung>
            </Anwendungssoftware>
            <Anwendungssoftware name="AdobePlayer">
                <Beschreibung>Text</Beschreibung>
            </Anwendungssoftware>
        </Softwarelizenzen>
    </Labor>
    <!-- <Labor>
        <Rechner inventarNr="">
            <Anschaffungsdatum/>
            <Beschreibung></Beschreibung>
            <Betriebssystem name=""/>
        </Rechner>
        <Softwarelizenzen>
            <Betriebssystem name="">
                <Beschreibung></Beschreibung>
            </Betriebssystem>
        </Softwarelizenzen>
    </Labor> -->
    <Labor name="Multimedialabor" raumNr="Z2320">
        <Rechner inventarNr="000.001">
            <Anschaffungsdatum datum="2016-10-28"/>
            <Beschreibung></Beschreibung>
            <Betriebssystem name=""/>
        </Rechner>
        <Softwarelizenzen>
            <Betriebssystem name="">
                <Beschreibung></Beschreibung>
            </Betriebssystem>
        </Softwarelizenzen>
    </Labor>
</Hochschullabore>